{
  "schema": "nma.public-demo-data-authority-matrix/1.0",
  "task": "DEMO-DATA-00",
  "assessed_at": "2026-08-22",
  "matrix_sha256": "2cccebe3753385ad1a441b51b776976ec0db9953861ec12a66ab9e27842a1227",
  "verdict": {
    "status": "fail-closed",
    "terminal_text": "FAIL — PUBLIC DEMO DATA AUTHORITY OR FROZEN CONTRACT COMPATIBILITY NOT CLOSED",
    "reason_codes": [
      "SCHOOL_PUBLIC_DEMO_REQUIRES_POST_FREEZE_AUTHORIZATION_CHANGE",
      "ROAD_PUBLIC_DEMO_REQUIRES_POST_FREEZE_EXECUTION_AND_AUTHORIZATION_CHANGE"
    ]
  },
  "repository": {
    "canonical_url": "https://github.com/dongpo/topoMap.git",
    "predecessor_commit": "9e59237296ed3baed551db2bbd565234a1b02db5",
    "branch": "demo/demo-data-00-public-demo-data-closure"
  },
  "frozen_identities": {
    "gen_final": {
      "commit": "380cc6ea2a4498ce83690521c933accfd918818e",
      "tag": "nma-generalization-v1.0-final",
      "immutable": true
    },
    "build_final": {
      "commit": "95de5fa3657a2c8ac7847f1ee1010c48ea984cd7",
      "tag": "nma-build-v1.0-final",
      "immutable": true
    },
    "core_final": {
      "commit": "5eb138ae7686502431587743ebce9ddf92c5a799",
      "tag": "nma-core-v1.0-final",
      "immutable": true
    },
    "road_final": {
      "commit": "325c70d5335f57c43a8af85822db25032aa225c3",
      "tag": "nma-road-v1.0-final",
      "immutable": true
    },
    "school_hero": {
      "commit": "56f99eb9ae63272a68accac3041fb10eacefb986",
      "tag": null,
      "immutable": true
    }
  },
  "publication_classifications": [
    "REDISTRIBUTION_EXPLICITLY_ALLOWED",
    "REDISTRIBUTION_ALLOWED_WITH_ATTRIBUTION",
    "DERIVED_DATA_ALLOWED",
    "ACCESS_ONLY",
    "AUTHORITY_UNRESOLVED",
    "REDISTRIBUTION_PROHIBITED"
  ],
  "source_candidates": [
    {
      "candidate_id": "school-nlsc-campus-121",
      "domain": "School",
      "publisher": "Ministry of the Interior Land Surveying and Mapping Center",
      "dataset_title": "各級學校範圍圖_121分帶",
      "source_url": "https://data.gov.tw/dataset/174606",
      "access_mechanism": "Official data.gov.tw SHP resource link",
      "access_authority": {
        "status": "EXPLICITLY_ALLOWED",
        "basis": "The official dataset page publishes a SHP resource for public access.",
        "uncertainty": "The payload was not downloaded because incompatibility is already established by official metadata."
      },
      "use_authority": {
        "status": "EXPLICITLY_ALLOWED",
        "basis": "Open Government Data License version 1.0 permits use for any purpose.",
        "uncertainty": "No dataset-specific exception is displayed on the official metadata page."
      },
      "redistribution_classification": "REDISTRIBUTION_ALLOWED_WITH_ATTRIBUTION",
      "redistribution_authority": {
        "status": "ALLOWED_WITH_ATTRIBUTION",
        "basis": "OGDL 1.0 grants reproduction, distribution, adaptation, and sublicensing subject to attribution.",
        "uncertainty": "This is a defensible publication basis, not a general legal opinion."
      },
      "provenance_authority": {
        "status": "EXPLICITLY_ALLOWED",
        "basis": "The official metadata names the publishing agency, dataset derivation, fields, resource type, license, and update metadata.",
        "uncertainty": "No exact retrieved payload identity was established."
      },
      "license": {
        "name": "Open Government Data License",
        "version": "1.0",
        "terms_url": "https://data.gov.tw/license"
      },
      "attribution_required": true,
      "modification_rules": "Derived works are allowed and remain subject to explicit attribution; transformation does not remove source obligations.",
      "access_date": "2026-08-22",
      "source_retrieved": false,
      "retrieval_identity": null,
      "evidence": [
        {
          "url": "https://data.gov.tw/dataset/174606",
          "locator": "dataset description, fields, resource, agency, and license",
          "summary": "Official metadata identifies a school-area dataset derived from Taiwan Universal Electronic Map BLOCK features, fields OBJECTID/ID/BLOCKTYPE/BLOCKNAME/YYYYMM/EPSGCode, a SHP resource, NLSC as publisher, and OGDL 1.0."
        },
        {
          "url": "https://data.gov.tw/license",
          "locator": "sections 2.1-2.3, 3.2, and attribution exhibit",
          "summary": "OGDL 1.0 permits reproduction, distribution, compilation, adaptation, and sublicensing, with explicit attribution required."
        }
      ],
      "contract_compatibility": {
        "status": "INCOMPATIBLE",
        "frozen_contract": "School Hero 56f99eb / nma.real-layer-plan/0.4 / nma.symbol-edit-authorization/1.0",
        "verified_requirements": {
          "source_layers": ["J01_MARK", "J13_MARK", "J17_MARK", "K01_MARK", "K02_MARK", "K14_MARK"],
          "geometry_type": "Point",
          "required_fields": ["MARKID", "TERRAINID", "MARKNAME1"],
          "terrainid": "9920103",
          "feature_count": 15,
          "output_crs": "EPSG:4326"
        },
        "blockers": [
          "Official metadata describes a BLOCK-derived school-area dataset, not the six frozen MARK source layers.",
          "Advertised fields do not provide MARKID, TERRAINID, or MARKNAME1.",
          "No exact 15-feature Point selection or source-to-layer relationship is established.",
          "Renaming or repartitioning the source into frozen historical layer names would misstate provenance."
        ],
        "frozen_changes_required": true
      },
      "decision": "REJECT_CONTRACT_INCOMPATIBLE"
    },
    {
      "candidate_id": "school-chiayi-special-education-points",
      "domain": "School",
      "publisher": "Chiayi City Government",
      "dataset_title": "嘉義市設有特殊教育班級之學校",
      "source_url": "https://data.gov.tw/dataset/52297",
      "access_mechanism": "Official data.gov.tw CSV resource link",
      "access_authority": {
        "status": "EXPLICITLY_ALLOWED",
        "basis": "The official dataset page publishes a CSV resource for public access.",
        "uncertainty": "The payload was not downloaded because metadata-level incompatibility is sufficient to reject it."
      },
      "use_authority": {
        "status": "EXPLICITLY_ALLOWED",
        "basis": "Open Government Data License version 1.0 permits use for any purpose.",
        "uncertainty": "No dataset-specific exception is displayed on the official metadata page."
      },
      "redistribution_classification": "REDISTRIBUTION_ALLOWED_WITH_ATTRIBUTION",
      "redistribution_authority": {
        "status": "ALLOWED_WITH_ATTRIBUTION",
        "basis": "OGDL 1.0 grants reproduction, distribution, adaptation, and sublicensing subject to attribution.",
        "uncertainty": "This is a defensible publication basis, not a general legal opinion."
      },
      "provenance_authority": {
        "status": "EXPLICITLY_ALLOWED",
        "basis": "The official metadata names the publishing agency, dataset, fields, resource type, license, and update metadata.",
        "uncertainty": "No exact retrieved payload identity was established."
      },
      "license": {
        "name": "Open Government Data License",
        "version": "1.0",
        "terms_url": "https://data.gov.tw/license"
      },
      "attribution_required": true,
      "modification_rules": "Derived works are allowed and remain subject to explicit attribution; transformation does not remove source obligations.",
      "access_date": "2026-08-22",
      "source_retrieved": false,
      "retrieval_identity": null,
      "evidence": [
        {
          "url": "https://data.gov.tw/dataset/52297",
          "locator": "fields, resource, agency, and license",
          "summary": "Official metadata advertises school name, education stage, latitude and longitude in a CSV published by Chiayi City Government under OGDL 1.0."
        },
        {
          "url": "https://data.gov.tw/license",
          "locator": "sections 2.1-2.3, 3.2, and attribution exhibit",
          "summary": "OGDL 1.0 permits reproduction, distribution, compilation, adaptation, and sublicensing, with explicit attribution required."
        }
      ],
      "contract_compatibility": {
        "status": "INCOMPATIBLE",
        "frozen_contract": "School Hero 56f99eb / nma.real-layer-plan/0.4 / nma.symbol-edit-authorization/1.0",
        "verified_requirements": {
          "source_layers": ["J01_MARK", "J13_MARK", "J17_MARK", "K01_MARK", "K02_MARK", "K14_MARK"],
          "geometry_type": "Point",
          "required_fields": ["MARKID", "TERRAINID", "MARKNAME1"],
          "terrainid": "9920103",
          "feature_count": 15,
          "output_crs": "EPSG:4326"
        },
        "blockers": [
          "The official source is one CSV, not six reviewed MARK Shapefile layers.",
          "Advertised fields do not provide MARKID, TERRAINID, or the reviewed TERRAINID 9920103 classification.",
          "No source-backed relationship maps records to J01/J13/J17/K01/K02/K14.",
          "Artificial repartitioning under frozen source-layer names would be license-compliant but provenance-false."
        ],
        "frozen_changes_required": true
      },
      "decision": "REJECT_CONTRACT_INCOMPATIBLE"
    },
    {
      "candidate_id": "road-nlsc-national-provincial-centerline",
      "domain": "ROAD",
      "publisher": "Ministry of the Interior Land Surveying and Mapping Center",
      "dataset_title": "National highways and provincial highways (including roads above the level of expressways) center line",
      "source_url": "https://data.gov.tw/en/datasets/73232",
      "access_mechanism": "Official data.gov.tw ZIP resource and NLSC open-data SHP zone",
      "access_authority": {
        "status": "EXPLICITLY_ALLOWED",
        "basis": "The official dataset page provides a ZIP resource and directs SHP users to the NLSC open-data zone.",